Concept name,Parts
photography and videography,"monitor with screen, battery, camera, landing gear, frame, rotor, remote controller"
surveying and mapping,"landing gear, propellers, camera, gps module, sensor array, lidar sensor, onboard pc"
environmental monitoring,"camera, landing gear, sensor array, rotor, frame"
police,"camera, landing gear, led lights, frame, rotor, police markings"
recreational,"battery, camera, frame, landing gear, rotor, remote controller"
inspection,"cameras, landing gear"
,
ships has 15 concepts,
submarine,"deck, bridge, periscope, hull, propeller, conning tower"
battle cruiser,"hull, turret, funnels, radar mast, bow"
cruiser,"bridge, deck, turret, hull"
cruise ship,"lifeboat, deck, bridge, hull"
battle ship,"radar system, conning tower, bridge, turret"
ice breaker,"bow, bridge, hull"
corvette,"hull, helicopter pad, bridge, turret, radar mast, bow"
destroyer,"radar mast, bridge, turret"
aircraft carrier,"catapult, bridge, flight deck"
clipper,"bow, sail, hull, mast"
amphibious,"radar mast, hull, turret, well deck, conning tower"
container ship,"bridge, cargo, hull"
ocean liner,"bow, stern, funnels, hull"
oil tanker,"anchor, deck, bridge, stern, hull"
coastal defense,"turret, radar system, communications mast"
,
geometry has 8 concepts,
parallel lines,"parallel line 2, parallel line 1"
intersecting lines,"line 2, intersection point, line 1"
ray,vertex
angle,"vertex, ray"
perpendicular lines,"intersection point, perpendicular line 1, perpendicular line 2"
cone,circular base
cylinder,"circular bottom, circular top"
circular sector,"radius, arc"
,
airplanes has 15 concepts,
attack,"bomb, bomb racks, propulsion component, wings"
fighters,"tail fin, afterburner, propulsion component, wings"
fire fighter,"wings, propulsion component, fire retardant"
transport,"propulsion component, openable nose, wings"
marine patrol,"wings, propulsion component"
agricultural,"propulsion component, landing gear, spraying rig, wings, cockpit"
reconnaissance,"propulsion component, wings"
tankers,"propulsion component, wings, refueling boom"
bombers,"wings, propulsion component"
business jets,"row of windows, propulsion component, wings"
narrow body single aisle aircraft,"row of windows, propulsion component, wings"
regional jets,"wings, row of windows, propulsion component"
wide body twin aisle aircraft,"propulsion component, row of windows, wings"
private,"cockpit, propulsion component, wings"
ultralight,"glider wings, fixed landing gear"
,
